{
  "version": 1,
  "costScale": {
    "normal": 1,
    "dusk": 1,
    "hard": 1.25,
    "lunatic": 1.5
  },
  "burdens": {
    "ill_omen": {
      "label": "Ill Omen",
      "line": "Each victory gathers more shadow until the omen passes.",
      "battles": 3,
      "extraShadow": 1,
      "onRung": {
        "normal": {
          "battles": 2
        }
      }
    },
    "debt": {
      "label": "Debt",
      "line": "The lender takes a share of each victory's gold until the debt is paid.",
      "garnish": 0.5,
      "onRung": {
        "normal": {
          "garnish": 0.25
        }
      }
    },
    "hunted": {
      "label": "Hunted",
      "line": "Something follows your trail: the next battles each bring a wave of fresh foes. Boss maps are spared.",
      "battles": 2,
      "wave": {
        "turn": 3,
        "count": [
          2,
          2
        ],
        "xpMultiplier": 0.5
      },
      "onRung": {
        "normal": {
          "wave": {
            "turn": 3,
            "count": [
              1,
              2
            ],
            "xpMultiplier": 0.5
          }
        },
        "lunatic": {
          "wave": {
            "turn": 3,
            "count": [
              2,
              3
            ],
            "xpMultiplier": 0.5
          }
        }
      }
    },
    "sworn_enemy": {
      "label": "Sworn Enemy",
      "line": "The act's boss has sworn to end you, and fights with a gift from the dark until it falls."
    },
    "wounded": {
      "label": "Lingering Injury",
      "line": "An injury that has not healed. They fight at a penalty until it mends.",
      "battles": 3,
      "value": -2,
      "onRung": {
        "normal": {
          "battles": 2
        }
      }
    }
  },
  "events": [
    {
      "id": "old_swordmaster",
      "title": "The Old Swordmaster",
      "acts": [
        "act1",
        "act2"
      ],
      "weight": 1,
      "intro": "An old woman is splitting firewood with a practice sword. She hasn't missed a log. \"You're staring,\" she says, without looking up.",
      "choices": [
        {
          "id": "train",
          "label": "Ask her to teach",
          "hint": "She looks at your sword arm, not your face.",
          "target": {
            "prompt": "Who trains with her?",
            "filter": {
              "weaponTypes": [
                "Sword",
                "Lance",
                "Axe"
              ]
            },
            "reason": "No one here fights with a sword, lance or axe."
          },
          "outcomes": [
            {
              "id": "taught",
              "weight": 70,
              "weightByRung": {
                "hard": 60,
                "lunatic": 55
              },
              "text": "She drills them until dark. \"Again.\" Again. Then, at last: \"Fine.\"",
              "effects": [
                {
                  "type": "learnSkill",
                  "to": "target",
                  "poolByType": {
                    "Sword": [
                      "darting_blow",
                      "duelist_stance",
                      "vantage",
                      "uncanny_blow"
                    ],
                    "Lance": [
                      "guard",
                      "pavise",
                      "armored_blow",
                      "warding_blow"
                    ],
                    "Axe": [
                      "death_blow",
                      "wrath",
                      "fury"
                    ]
                  }
                },
                {
                  "type": "hp",
                  "mode": "damage",
                  "percent": 30,
                  "scope": "target"
                }
              ],
              "fallbackText": "She drills them until dark, then shakes her head. \"Nothing left to show you.\" She feeds you instead.",
              "fallback": [
                {
                  "type": "hp",
                  "mode": "heal",
                  "percent": 20,
                  "scope": "all"
                }
              ]
            },
            {
              "id": "refused",
              "weight": 30,
              "text": "\"No.\" She doesn't explain. She does, however, feed you.",
              "effects": [
                {
                  "type": "hp",
                  "mode": "heal",
                  "percent": 20,
                  "scope": "all"
                }
              ]
            }
          ]
        },
        {
          "id": "spar",
          "label": "Spar with her",
          "hint": "Quick hands and a sharp eye will matter more than talk.",
          "target": {
            "prompt": "Who spars with her?",
            "filter": {
              "weaponTypes": [
                "Sword",
                "Lance",
                "Axe"
              ]
            },
            "reason": "No one here fights with a sword, lance or axe."
          },
          "check": {
            "stats": [
              "SKL",
              "SPD"
            ],
            "of": "target",
            "base": 0.3,
            "perPoint": 0.025,
            "against": 24,
            "min": 0.15,
            "max": 0.85,
            "byRung": {
              "lunatic": -0.1
            }
          },
          "outcomes": [
            {
              "id": "pass",
              "text": "Their blade stops at her collar. She laughs, really laughs, and fetches something wrapped in oilcloth.",
              "effects": [
                {
                  "type": "learnSkill",
                  "to": "target",
                  "poolByType": {
                    "Sword": [
                      "darting_blow",
                      "duelist_stance",
                      "vantage",
                      "uncanny_blow"
                    ],
                    "Lance": [
                      "guard",
                      "pavise",
                      "armored_blow",
                      "warding_blow"
                    ],
                    "Axe": [
                      "death_blow",
                      "wrath",
                      "fury"
                    ]
                  }
                },
                {
                  "type": "item",
                  "pool": {
                    "kind": "weapon",
                    "weaponTypes": "$target",
                    "tierOffset": 1
                  },
                  "to": "target"
                }
              ],
              "fallbackText": "Their blade stops at her collar. She laughs, and fetches something wrapped in oilcloth. \"I've taught you all I know.\"",
              "fallback": [
                {
                  "type": "item",
                  "pool": {
                    "kind": "weapon",
                    "weaponTypes": "$target",
                    "tierOffset": 1
                  },
                  "to": "target"
                }
              ]
            },
            {
              "id": "fail",
              "text": "She taps their wrist. The sword drops. \"Dead,\" she says. \"Twice.\"",
              "effects": [
                {
                  "type": "hp",
                  "mode": "damage",
                  "to": 1,
                  "scope": "target"
                }
              ]
            }
          ]
        },
        {
          "id": "leave",
          "label": "Leave her to her wood",
          "outcomes": [
            {
              "id": "left",
              "weight": 100,
              "text": "She nods at the woodpile as you go. It's very neat.",
              "effects": []
            }
          ]
        }
      ]
    },
    {
      "id": "abandoned_armory",
      "title": "The Abandoned Armory",
      "acts": [
        "act1",
        "act2",
        "act3"
      ],
      "weight": 1,
      "intro": "The garrison left in a hurry: boots by the door, a cold pot, racks of weapons nobody came back for. Somewhere inside, a door is barred from the wrong side.",
      "choices": [
        {
          "id": "racks",
          "label": "Take from the racks",
          "hint": "Plain issue, oiled and ready.",
          "outcomes": [
            {
              "id": "issued",
              "weight": 100,
              "text": "Plain issue, oiled and ready. Someone kept this place.",
              "effects": [
                {
                  "type": "item",
                  "pool": {
                    "kind": "weapon",
                    "weaponTypes": "$army",
                    "tierOffset": 0
                  },
                  "to": "auto"
                }
              ]
            }
          ]
        },
        {
          "id": "office",
          "label": "Search the quartermaster's desk",
          "hint": "Offices keep their best things where the wrong people won't look. Or where they will.",
          "outcomes": [
            {
              "id": "cache",
              "weight": 55,
              "weightByRung": {
                "hard": 45
              },
              "text": "Under a loose board: a fine weapon, badly kept.",
              "effects": [
                {
                  "type": "item",
                  "pool": {
                    "kind": "weapon",
                    "weaponTypes": "$army",
                    "tierOffset": 1
                  },
                  "to": "auto",
                  "wear": 2
                }
              ]
            },
            {
              "id": "tripwire",
              "weight": 45,
              "weightByRung": {
                "hard": 55
              },
              "text": "A wire, a click, and the shelf comes down on whoever was first through the door. A few coins roll out of the wreckage.",
              "effects": [
                {
                  "type": "hp",
                  "mode": "damage",
                  "percent": 40,